{
  "schema_version": "2.1",
  "original_idea_summary": "用单个通用图生成模型（TAGSE + MoE + 三阶段课程训练），为任意自然语言任务描述生成自适应的多智能体协作拓扑（有向无环图），以替代每个任务域单独训练的一对一专门模型。",
  "dissatisfaction_types": [
    "unclear_mechanism",
    "weak_testability",
    "unclear_prior_difference"
  ],
  "primary_bottleneck": "如何用一个通用模型，把任意任务描述映射成高质量的 MAS 协作拓扑，从而跨域泛化并复用结构知识，同时优于一对一专门模型。",
  "core_value_to_preserve": "用单个通用模型为任意自然语言任务生成自适应协作拓扑，并在跨域 benchmark 上超过一对一专门模型。",
  "most_promising_change_target": "建议优先考虑 LP-001（一对多范式反转）、LP-002（拓扑 vs 内容谁是主要矛盾）、LP-003（评价口径扩展）、LP-004（合成数据质量作为研究对象）这四个高杠杆点：它们分别触及范式、优化对象、评价规则与监督信号，覆盖面广且各自可独立产出可验证的研究问题。LP-005（静态→动态拓扑）适合想做结构性大重构的人。最终由人类在 Gate 1 选择。",
  "downstream_focus": "建议优先考虑 LP-001（一对多范式反转）、LP-002（拓扑 vs 内容谁是主要矛盾）、LP-003（评价口径扩展）、LP-004（合成数据质量作为研究对象）这四个高杠杆点：它们分别触及范式、优化对象、评价规则与监督信号，覆盖面广且各自可独立产出可验证的研究问题。LP-005（静态→动态拓扑）适合想做结构性大重构的人。最终由人类在 Gate 1 选择。"
}
